{
  "artifact": {
    "adf_file": "aga-fine-lores.adf",
    "adf_sha256": "4ef2e3f4fdb0fdb996156f7c07facad56b7b589a9536d21627d888c02ebaaf1b",
    "payload_file": "aga-fine-lores.bin",
    "payload_sha256": "c087c78090158325ef92399dff99b39b4709b3c58a6a8bd58bdec871a6c28d18"
  },
  "case_id": "aga-fine-lores",
  "execution": {
    "adjacent_field_stability": "confirmed",
    "captured_fields": [
      89,
      90,
      91
    ],
    "cold_boot": true,
    "command_or_procedure": "tools/fs-uae-hblank-capture/capture.sh aga aga-fine-lores <FS-UAE-5.0.7-f362278ccd4c60991caac3b4d240d4a3f751bea2> <suite-1.0.1-directory> <firmware-matching-recorded-sha256> <fresh-output-directory> <operator>",
    "configuration_sha256": "998c8d7ee63f73c62affe126786905734b47c45cbb3a68f9e7102d87efa245d2",
    "ready_observed_field": 81,
    "ready_rule": {
      "byte_order": "big-endian",
      "case_number": 8,
      "field_counter_minimum": 8,
      "magic": "HBLK",
      "record_address": "0x0002ff00"
    },
    "settle_fields": 8
  },
  "machine": {
    "agnus": "AGA Alice",
    "chipset": "AGA",
    "cpu": "Motorola 68EC020",
    "denise_or_lisa": "AGA Lisa",
    "firmware": {
      "revision": "Kickstart 3.1 revision 40.068",
      "sha256": "6d43840d4099a74170ea0f0425b6257c3891ebcaa39c4d1840075a9ab22b5707"
    },
    "model": "A1200",
    "ram_bytes": 2097152,
    "region": "PAL"
  },
  "normalization": {
    "alignment_search": false,
    "beam_coordinate": {
      "horizontal_origin_sample": -184,
      "horizontal_samples_per_register_increment_denominator": 1,
      "horizontal_samples_per_register_increment_numerator": 4,
      "phase_denominator": 1,
      "phase_numerator": 0,
      "sample_beam_line": 128,
      "sample_row": 202
    },
    "color_conversion": "lossless BGRA-to-RGBA channel reorder; PNG RGBA8 decoded without colour management",
    "crop": {
      "height": 576,
      "width": 756,
      "x": 0,
      "y": 0
    },
    "field_handling": "bob"
  },
  "observations": {
    "blank_start_samples": [
      328,
      328,
      328
    ],
    "blank_stop_samples": [
      459,
      459,
      459
    ],
    "equal_outcome": "not-applicable",
    "guard_color_word": "0x8f0",
    "interval_convention": "start-inclusive-stop-exclusive",
    "notes": [
      "Raw sample row 202 contained black runs [0, 2), [328, 459) in all three byte-identical adjacent fields.",
      "The raw x=[0, 2) transparent-black producer boundary is retained in the APNG and the black-run audit, but is not interpreted as a programmable-HBLANK edge.",
      "Ready was observed at core field 81 with guest field 1; after 8 fields, core fields [89, 90, 91] and guest counters [9, 10, 11] were captured.",
      "The source-derived raw mapping is x=4*(register&0xff)+floor(((register>>8)&7)/2)-184. It came from the producer source path; no image-alignment search was performed.",
      "The 756 by 576 UAE core framebuffer was preserved in full. The recorded 752 by 572 FS-UAE frontend compatibility view was not applied.",
      "Captured configuration ../configs/aga--aga-fine-lores.uae has SHA-256 998c8d7ee63f73c62affe126786905734b47c45cbb3a68f9e7102d87efa245d2.",
      "Raw run log ../logs/aga--aga-fine-lores.log has SHA-256 dd6ed67740189ddb197cf2e5e26269a2e0e6ffe1ded16619ba53a2d6d099d552.",
      "Capture-time manifest ../manifests/aga--aga-fine-lores.json has SHA-256 024b91d6a13a2953e943054272c4e0570441cd9246a448502e3b63f16a41ee33.",
      "The AGA fine stop word 0x07a0 produced raw stop sample 459 in lores mode."
    ],
    "uncertainty_samples": 0,
    "wrap_outcome": "does-not-wrap"
  },
  "producer": {
    "implementation_family": "UAE",
    "kind": "software-emulator",
    "product": "FS-UAE",
    "revision": "f362278ccd4c60991caac3b4d240d4a3f751bea2",
    "source_url": "https://github.com/FrodeSolheim/fs-uae",
    "version": "5.0.7"
  },
  "provenance": {
    "capture_date": "2026-07-29",
    "classification": "software-derived",
    "host": "macOS 26.5.2 build 25F84, arm64",
    "operator": "Codex (OpenAI), supervised by Steve Hill"
  },
  "schema_version": "1.0.0",
  "source_capture": {
    "blanking_retained": true,
    "decoded_pixel_sha256": "25b0a8f79ca3cbe3a806459c7b1d190441ef0a135d685137799d51f24863b6b8",
    "file_name": "../captures/aga--aga-fine-lores.apng",
    "file_sha256": "a508b2525e9cc41fa30f5cc4a75c0b2d83120b184166f3d22bac8e1f33f9f354",
    "filter": "none",
    "height": 576,
    "method": "FS-UAE raw UAE-core framebuffer hook, losslessly reordered from BGRA and packaged as APNG",
    "overscan_retained": true,
    "pixel_format": "RGBA8888, tightly packed, row-major; alpha retained from source BGRA8888",
    "scaling": "none",
    "shader": "none",
    "stride_bytes": 3024,
    "width": 756
  },
  "suite_id": "org.198x.amiga.programmable-hblank",
  "suite_version": "1.0.1"
}
