{
  "artifact": {
    "adf_file": "programmed-equal.adf",
    "adf_sha256": "136f73e79668040f49f5a7e497e2de2e480f2bd1cab4a30512003ef87d172ac7",
    "payload_file": "programmed-equal.bin",
    "payload_sha256": "8ce71767c39c32839ae86601f9cca401304b363647b63db8bfc55b00fa15e5b2"
  },
  "case_id": "programmed-equal",
  "execution": {
    "adjacent_field_stability": "confirmed",
    "captured_fields": [
      400,
      401,
      402
    ],
    "cold_boot": true,
    "command_or_procedure": "./capture.sh ecs programmed-equal <Copperline-eec5806778dab8b60f3b05fa7ab2428e4e18b073> <suite-1.0.1-directory> <firmware-matching-recorded-sha256> <fresh-output-directory> <operator>",
    "configuration_sha256": "a4809260eaf8e00d0e0bffaf638ed448410c12981144f3a8221c19def9a61d69",
    "ready_observed_field": 390,
    "ready_rule": {
      "byte_order": "big-endian",
      "case_number": 7,
      "field_counter_minimum": 8,
      "magic": "HBLK",
      "record_address": "0x0002ff00"
    },
    "settle_fields": 10
  },
  "machine": {
    "agnus": "8375 ECS Agnus",
    "chipset": "ECS",
    "cpu": "Motorola 68000",
    "denise_or_lisa": "8373 ECS Denise",
    "firmware": {
      "revision": "Kickstart 2.04 revision 37.175",
      "sha256": "d0b70e8a1772614b897f92c33cb299bed3fc8e3de488fc12f67f97fc2486eb79"
    },
    "model": "A500 Plus",
    "ram_bytes": 1048576,
    "region": "PAL"
  },
  "normalization": {
    "alignment_search": false,
    "beam_coordinate": {
      "horizontal_origin_sample": -196,
      "horizontal_samples_per_register_increment_denominator": 1,
      "horizontal_samples_per_register_increment_numerator": 4,
      "phase_denominator": 1,
      "phase_numerator": 0,
      "sample_beam_line": 128,
      "sample_row": 200
    },
    "color_conversion": "PNG RGBA8 decoded without colour management",
    "crop": {
      "height": 570,
      "width": 716,
      "x": 0,
      "y": 0
    },
    "field_handling": "bob"
  },
  "observations": {
    "blank_start_samples": [
      null,
      null,
      null
    ],
    "blank_stop_samples": [
      null,
      null,
      null
    ],
    "equal_outcome": "empty",
    "guard_color_word": "0xfff",
    "interval_convention": "not-applicable",
    "notes": [
      "Sample row 200 contained black runs none in all three byte-identical adjacent fields.",
      "The ready record held probe field counter 190. Copperline dump labels [400, 401, 402] contain the fields that just completed at those boundaries, with probe field counters [200, 201, 202].",
      "The beam-to-sample mapping came from an audited producer path; no image alignment search was performed.",
      "Raw run log ../logs/ecs--programmed-equal.log has SHA-256 41d2a3d85d9dd0275e01a4ca6ed9dfc8083e02c323538271f5cc5b1d8f870c7a.",
      "Capture-time manifest ../manifests/ecs--programmed-equal.json has SHA-256 b6c72a034f71678d13af755e8a886e2b843966c9ecab37a46aa12cb2476b03f6."
    ],
    "uncertainty_samples": 0,
    "wrap_outcome": "not-applicable"
  },
  "producer": {
    "implementation_family": "Copperline",
    "kind": "software-emulator",
    "product": "Copperline",
    "revision": "eec5806778dab8b60f3b05fa7ab2428e4e18b073",
    "source_url": "https://github.com/CopperlineHQ/Copperline",
    "version": "0.13.0"
  },
  "provenance": {
    "capture_date": "2026-07-29",
    "classification": "software-derived",
    "host": "macOS 26.5.2 build 25F84, arm64",
    "operator": "Codex (OpenAI), supervised by Steve Hill"
  },
  "schema_version": "1.0.0",
  "source_capture": {
    "blanking_retained": true,
    "decoded_pixel_sha256": "03e1477fe31562486e13128bf47a9bc33b203a2d2ecacb5b93dfe4f81ae52eb2",
    "file_name": "../captures/ecs--programmed-equal.apng",
    "file_sha256": "ec12582252d9b951f721ecad673af9e0eb1e66545c84ee9ba1ccd336f27375a0",
    "filter": "none",
    "height": 570,
    "method": "Copperline raw headless frame dump, packaged as APNG",
    "overscan_retained": true,
    "pixel_format": "RGBA8888, tightly packed, row-major",
    "scaling": "none",
    "shader": "none",
    "stride_bytes": 2864,
    "width": 716
  },
  "suite_id": "org.198x.amiga.programmable-hblank",
  "suite_version": "1.0.1"
}
